{
  "id": "conf::a6_2_out_of_set_hello_is_lost_worker_version",
  "contract": "core",
  "clause": "A6-2",
  "subject": "core",
  "requires": {
    "controls": [
      "announce_protocol"
    ]
  },
  "fake": "structural",
  "ruling": "R-12",
  "steps": [
    {
      "begin": {
        "op": {
          "Create": {
            "session": "s1",
            "request": {
              "program": [
                {
                  "hold": {}
                }
              ]
            }
          }
        }
      },
      "bind": "$c_s1"
    },
    {
      "pump_until": {
        "event": {
          "Completed": {
            "op": "$c_s1",
            "result": {
              "ok": {
                "record": {
                  "id": "s1",
                  "state": "Created"
                }
              }
            }
          }
        }
      },
      "because": "Core LC-3"
    },
    {
      "begin": {
        "op": {
          "Start": {
            "id": "s1"
          }
        }
      },
      "bind": "$s_s1"
    },
    {
      "pump_until": {
        "event": {
          "Completed": {
            "op": "$s_s1",
            "result": {
              "ok": {
                "record": {
                  "id": "s1",
                  "state": "Running"
                }
              }
            }
          }
        }
      },
      "because": "Core A2-1"
    },
    {
      "begin": {
        "op": {
          "Create": {
            "session": "s2",
            "request": {
              "program": [
                {
                  "hold": {}
                }
              ]
            }
          }
        }
      },
      "bind": "$c_s2"
    },
    {
      "pump_until": {
        "event": {
          "Completed": {
            "op": "$c_s2",
            "result": {
              "ok": {
                "record": {
                  "id": "s2",
                  "state": "Created"
                }
              }
            }
          }
        }
      },
      "because": "Core LC-3"
    },
    {
      "begin": {
        "op": {
          "Start": {
            "id": "s2"
          }
        }
      },
      "bind": "$s_s2"
    },
    {
      "pump_until": {
        "event": {
          "Completed": {
            "op": "$s_s2",
            "result": {
              "ok": {
                "record": {
                  "id": "s2",
                  "state": "Running"
                }
              }
            }
          }
        }
      },
      "because": "Core A2-1"
    },
    {
      "control": {
        "op": "announce_protocol",
        "session": "s1",
        "protocol": 2
      }
    },
    {
      "control": {
        "op": "announce_protocol",
        "session": "s2",
        "protocol": 9
      }
    },
    {
      "drop": {
        "handle": "h"
      }
    },
    {
      "open": {
        "as": "h2"
      }
    },
    {
      "begin": {
        "op": "AdoptAll",
        "handle": "h2"
      },
      "bind": "$aa"
    },
    {
      "pump_collect": {
        "events": [
          {
            "SessionState": {
              "id": "s1",
              "state": {
                "Lost": "WorkerVersion"
              }
            }
          },
          {
            "SessionState": {
              "id": "s2",
              "state": {
                "Lost": "WorkerVersion"
              }
            }
          },
          {
            "Completed": {
              "op": "$aa",
              "result": {
                "ok": "unit"
              }
            }
          }
        ],
        "handle": "h2"
      },
      "because": [
        "Core A6-2",
        "Core AD-4",
        "Core LC-11",
        "Core A2-1"
      ]
    }
  ]
}
