{
 "id": "conf::pc_1_callee_must_opt_in_per_tool",
 "contract": "hp",
 "clause": "PC-1",
 "subject": "plugin_hub",
 "fake": "structural",
 "ruling": "R-1.3",
 "requires": {
  "controls": [
   "invoke",
   "load_plugin",
   "settle"
  ]
 },
 "setup": {
  "given": "demo requires x.echo, locked to provider b with the tools echo and closed (both belong to the interface); b opts in echo with callable_by plugins and does not opt in closed",
  "plugins": {
   "demo": {
    "grants": [
     {
      "surface": "plugins",
      "scope": "plugin_call:b"
     }
    ],
    "requires": [
     {
      "interface": "x.echo",
      "provider": "b",
      "tools": [
       "echo",
       "closed"
      ]
     }
    ]
   },
   "b": {
    "grants": []
   }
  }
 },
 "steps": [
  {
   "expect": {
    "lane": "control",
    "type": "Hello",
    "payload": {
     "epoch": "$e"
    }
   },
   "because": "HP HS-1"
  },
  {
   "send_frame": {
    "lane": "control",
    "type": "Ready",
    "payload": {
     "$ref": "ready",
     "epoch": "$e",
     "handlers": [
      {
       "id": "h1",
       "kind": "mcp_tool",
       "descriptor": {}
      }
     ]
    }
   }
  },
  {
   "expect": {
    "lane": "control",
    "type": "Activated",
    "payload": {
     "epoch": "$e"
    }
   },
   "because": "HP HS-2"
  },
  {
   "control": {
    "op": "invoke",
    "handler": "h1"
   },
   "bind": {
    "t": "/ticket"
   }
  },
  {
   "expect": {
    "lane": "invoke",
    "type": "Invoke",
    "payload": {
     "epoch": "$e",
     "request_id": "$r",
     "handler": "h1"
    }
   },
   "because": "HP IV-1"
  },
  {
   "control": {
    "op": "load_plugin",
    "plugin_key": "b",
    "as": "b"
   }
  },
  {
   "expect": {
    "lane": "control",
    "type": "Hello",
    "payload": {
     "epoch": "$e_b"
    }
   },
   "on": "b",
   "because": "HP HS-1"
  },
  {
   "send_frame": {
    "lane": "control",
    "type": "Ready",
    "payload": {
     "$ref": "ready",
     "epoch": "$e_b",
     "handlers": [
      {
       "id": "h1",
       "kind": "mcp_tool",
       "descriptor": {}
      }
     ],
     "tools": [
      {
       "name": "echo",
       "description": "d",
       "input_schema": {
        "type": "object"
       },
       "handler": "h1",
       "callable_by": [
        "plugins"
       ]
      },
      {
       "name": "closed",
       "description": "d",
       "input_schema": {
        "type": "object"
       },
       "handler": "h1"
      }
     ]
    }
   },
   "conn": "b"
  },
  {
   "expect": {
    "lane": "control",
    "type": "Activated",
    "payload": {
     "epoch": "$e_b"
    }
   },
   "on": "b",
   "because": "HP HS-2"
  },
  {
   "send_frame": {
    "lane": "call",
    "type": "HostCall",
    "payload": {
     "$ref": "host_call",
     "epoch": "$e",
     "call_id": 1,
     "call": "plugins.call",
     "context": {
      "request": "$r"
     },
     "args": {
      "interface": "x.echo",
      "tool": "closed",
      "args": {}
     }
    }
   }
  },
  {
   "expect": {
    "lane": "call",
    "type": "HostResult",
    "payload": {
     "epoch": "$e",
     "call_id": 1,
     "result": {
      "ok": false,
      "error": {
       "kind": "not_found"
      }
     },
     "effect": "none"
    }
   },
   "because": "HP PC-1"
  },
  {
   "expect_quiet_until": {
    "lane": "invoke",
    "type": "Invoke"
   },
   "on": "b",
   "barrier": {
    "control": {
     "op": "settle",
     "conn": "b"
    }
   },
   "until": {
    "settled": true
   },
   "because": "HP PC-1"
  },
  {
   "send_frame": {
    "lane": "call",
    "type": "HostCall",
    "payload": {
     "$ref": "host_call",
     "epoch": "$e",
     "call_id": 2,
     "call": "plugins.call",
     "context": {
      "request": "$r"
     },
     "args": {
      "interface": "x.echo",
      "tool": "echo",
      "args": {}
     }
    }
   }
  },
  {
   "expect": {
    "lane": "call",
    "type": "HostResult",
    "payload": {
     "epoch": "$e",
     "call_id": 2,
     "result": {
      "ok": true,
      "value": {
       "operation_id": "$op",
       "kind": "plugin_call",
       "state": "queued",
       "terminal": false
      }
     },
     "effect": "committed"
    }
   },
   "because": "HP PC-1"
  },
  {
   "expect": {
    "lane": "invoke",
    "type": "Invoke",
    "payload": {
     "epoch": "$e_b",
     "request_id": "$rb",
     "handler": "h1",
     "caller": {
      "kind": "plugin",
      "plugin_key": {
       "$type": "string"
      },
      "instance": {
       "$type": "string"
      }
     },
     "payload": {}
    }
   },
   "on": "b",
   "because": "HP PC-1"
  },
  {
   "send_frame": {
    "lane": "invoke",
    "type": "Result",
    "payload": {
     "epoch": "$e",
     "request_id": "$r",
     "result": {
      "ok": true,
      "value": {}
     }
    }
   }
  }
 ]
}
