{
 "id": "conf::px_2_terminal_record_shape",
 "contract": "hp",
 "clause": "PX-2",
 "subject": "plugin_hub",
 "fake": "structural",
 "ruling": "R-1.3",
 "requires": {
  "controls": [
   "invoke"
  ]
 },
 "setup": {
  "given": "the command prints ok and exits with code 3",
  "grants": [
   {
    "surface": "session_actions",
    "scope": "process_run"
   }
  ]
 },
 "steps": [
  {
   "expect": {
    "lane": "control",
    "type": "Hello",
    "payload": {
     "epoch": "$e"
    }
   },
   "because": "HP HS-1"
  },
  {
   "send_frame": {
    "lane": "control",
    "type": "Ready",
    "payload": {
     "$ref": "ready",
     "epoch": "$e",
     "handlers": [
      {
       "id": "h1",
       "kind": "mcp_tool",
       "descriptor": {}
      },
      {
       "id": "op",
       "kind": "operation",
       "descriptor": {}
      }
     ],
     "operations": {
      "subscribed": "op"
     }
    }
   }
  },
  {
   "expect": {
    "lane": "control",
    "type": "Activated",
    "payload": {
     "epoch": "$e"
    }
   },
   "because": "HP HS-2"
  },
  {
   "control": {
    "op": "invoke",
    "handler": "h1"
   },
   "bind": {
    "t": "/ticket"
   }
  },
  {
   "expect": {
    "lane": "invoke",
    "type": "Invoke",
    "payload": {
     "epoch": "$e",
     "request_id": "$r",
     "handler": "h1"
    }
   },
   "because": "HP IV-1"
  },
  {
   "send_frame": {
    "lane": "call",
    "type": "HostCall",
    "payload": {
     "$ref": "host_call",
     "epoch": "$e",
     "call_id": 1,
     "call": "process.run",
     "context": {
      "request": "$r"
     },
     "args": {
      "argv": [
       "sh",
       "-c",
       "printf ok; exit 3"
      ],
      "timeout_ms": 5000
     }
    }
   }
  },
  {
   "expect": {
    "lane": "call",
    "type": "HostResult",
    "payload": {
     "epoch": "$e",
     "call_id": 1,
     "result": {
      "ok": true,
      "value": {
       "operation_id": "$op",
       "kind": "process",
       "state": "queued",
       "terminal": false
      }
     },
     "effect": "committed"
    }
   },
   "because": "HP PX-1"
  },
  {
   "send_frame": {
    "lane": "invoke",
    "type": "Result",
    "payload": {
     "epoch": "$e",
     "request_id": "$r",
     "result": {
      "ok": true,
      "value": {}
     }
    }
   }
  },
  {
   "expect": {
    "lane": "invoke",
    "type": "Invoke",
    "payload": {
     "epoch": "$e",
     "request_id": "$rn",
     "handler": "op",
     "payload": {
      "operation_id": "$op",
      "kind": "process",
      "state": "done",
      "terminal": true,
      "exit_code": 3,
      "stdout_tail_b64": "b2s=",
      "stderr_tail_b64": "",
      "truncated": {
       "stdout": false,
       "stderr": false
      },
      "duration_ms": {
       "$type": "integer"
      }
     },
     "origin": "operation"
    }
   },
   "because": "HP PX-2"
  },
  {
   "send_frame": {
    "lane": "invoke",
    "type": "Result",
    "payload": {
     "epoch": "$e",
     "request_id": "$rn",
     "result": {
      "ok": true,
      "value": {}
     }
    }
   }
  }
 ]
}
