{
 "id": "conf::ev_9_restarted_source_has_new_instance",
 "contract": "hp",
 "clause": "EV-9",
 "subject": "plugin_hub",
 "fake": "structural",
 "ruling": "R-1.3",
 "requires": {
  "controls": [
   "invoke",
   "load_plugin",
   "service_connected"
  ]
 },
 "setup": {
  "given": "the plugin b declares the public plugins-audience event e",
  "grants": [
   {
    "surface": "events",
    "scope": "events_plugin:b"
   }
  ]
 },
 "steps": [
  {
   "expect": {
    "lane": "control",
    "type": "Hello",
    "payload": {
     "epoch": "$e"
    }
   },
   "because": "HP HS-1"
  },
  {
   "send_frame": {
    "lane": "control",
    "type": "Ready",
    "payload": {
     "$ref": "ready",
     "epoch": "$e",
     "handlers": [
      {
       "id": "h1",
       "kind": "mcp_tool",
       "descriptor": {}
      },
      {
       "id": "he",
       "kind": "event",
       "descriptor": {}
      },
      {
       "id": "hg",
       "kind": "event_gap",
       "descriptor": {}
      }
     ],
     "events": {
      "subscribed": [
       {
        "handler_id": "he",
        "pattern": {
         "owner": "b",
         "name": "e"
        }
       }
      ],
      "gap_handler": "hg"
     }
    }
   }
  },
  {
   "expect": {
    "lane": "control",
    "type": "Activated",
    "payload": {
     "epoch": "$e"
    }
   },
   "because": "HP HS-2"
  },
  {
   "control": {
    "op": "load_plugin",
    "plugin_key": "b",
    "as": "b"
   }
  },
  {
   "expect": {
    "lane": "control",
    "type": "Hello",
    "payload": {
     "epoch": "$e_b"
    }
   },
   "on": "b",
   "because": "HP HS-1"
  },
  {
   "send_frame": {
    "lane": "control",
    "type": "Ready",
    "payload": {
     "$ref": "ready",
     "epoch": "$e_b",
     "handlers": [
      {
       "id": "h1",
       "kind": "mcp_tool",
       "descriptor": {}
      },
      {
       "id": "he",
       "kind": "event",
       "descriptor": {}
      },
      {
       "id": "hg",
       "kind": "event_gap",
       "descriptor": {}
      }
     ],
     "events": {
      "declared": [
       {
        "name": "e",
        "payload_schema": {
         "type": "object"
        },
        "audience": [
         "plugins"
        ],
        "public": true,
        "priority": "normal"
       }
      ],
      "subscribed": [],
      "gap_handler": "hg"
     }
    }
   },
   "conn": "b"
  },
  {
   "expect": {
    "lane": "control",
    "type": "Activated",
    "payload": {
     "epoch": "$e_b"
    }
   },
   "on": "b",
   "because": "HP HS-2"
  },
  {
   "control": {
    "op": "invoke",
    "plugin": "b",
    "handler": "h1"
   },
   "bind": {
    "t_b": "/ticket"
   }
  },
  {
   "expect": {
    "lane": "invoke",
    "type": "Invoke",
    "payload": {
     "epoch": "$e_b",
     "request_id": "$r_b",
     "handler": "h1"
    }
   },
   "on": "b",
   "because": "HP IV-1"
  },
  {
   "send_frame": {
    "lane": "call",
    "type": "HostCall",
    "payload": {
     "$ref": "host_call",
     "epoch": "$e_b",
     "call_id": 1,
     "call": "events.emit",
     "context": {
      "request": "$r_b"
     },
     "args": {
      "name": "e",
      "payload": {
       "n": 1
      }
     }
    }
   },
   "conn": "b"
  },
  {
   "expect": {
    "lane": "call",
    "type": "HostResult",
    "payload": {
     "epoch": "$e_b",
     "call_id": 1,
     "result": {
      "ok": true,
      "value": {
       "status": "accepted"
      }
     },
     "effect": "committed"
    }
   },
   "on": "b",
   "because": "HP EV-1"
  },
  {
   "expect": {
    "lane": "invoke",
    "type": "Invoke",
    "payload": {
     "epoch": "$e",
     "request_id": "$c1",
     "handler": "he",
     "origin": "event",
     "payload": {
      "owner": "b",
      "name": "e",
      "source": {
       "kind": "plugin",
       "instance": "$i1"
      }
     }
    }
   },
   "because": "HP EV-9"
  },
  {
   "send_frame": {
    "lane": "invoke",
    "type": "Result",
    "payload": {
     "epoch": "$e",
     "request_id": "$c1",
     "result": {
      "ok": true,
      "value": {}
     }
    }
   }
  },
  {
   "close_channel": {},
   "conn": "b"
  },
  {
   "control": {
    "op": "service_connected",
    "plugin": "b"
   }
  },
  {
   "expect": {
    "lane": "control",
    "type": "Hello",
    "payload": {
     "epoch": "$e_b2"
    }
   },
   "on": "b",
   "because": "HP CR-3"
  },
  {
   "send_frame": {
    "lane": "control",
    "type": "Ready",
    "payload": {
     "$ref": "ready",
     "epoch": "$e_b2",
     "handlers": [
      {
       "id": "h1",
       "kind": "mcp_tool",
       "descriptor": {}
      },
      {
       "id": "he",
       "kind": "event",
       "descriptor": {}
      },
      {
       "id": "hg",
       "kind": "event_gap",
       "descriptor": {}
      }
     ],
     "events": {
      "declared": [
       {
        "name": "e",
        "payload_schema": {
         "type": "object"
        },
        "audience": [
         "plugins"
        ],
        "public": true,
        "priority": "normal"
       }
      ],
      "subscribed": [],
      "gap_handler": "hg"
     }
    }
   },
   "conn": "b"
  },
  {
   "expect": {
    "lane": "control",
    "type": "Activated",
    "payload": {
     "epoch": "$e_b2"
    }
   },
   "on": "b",
   "because": "HP HS-2"
  },
  {
   "control": {
    "op": "invoke",
    "plugin": "b",
    "handler": "h1"
   },
   "bind": {
    "t_b2": "/ticket"
   }
  },
  {
   "expect": {
    "lane": "invoke",
    "type": "Invoke",
    "payload": {
     "epoch": "$e_b2",
     "request_id": "$r_b2",
     "handler": "h1"
    }
   },
   "on": "b",
   "because": "HP IV-1"
  },
  {
   "send_frame": {
    "lane": "call",
    "type": "HostCall",
    "payload": {
     "$ref": "host_call",
     "epoch": "$e_b2",
     "call_id": 2,
     "call": "events.emit",
     "context": {
      "request": "$r_b2"
     },
     "args": {
      "name": "e",
      "payload": {
       "n": 2
      }
     }
    }
   },
   "conn": "b"
  },
  {
   "expect": {
    "lane": "call",
    "type": "HostResult",
    "payload": {
     "epoch": "$e_b2",
     "call_id": 2,
     "result": {
      "ok": true,
      "value": {
       "status": "accepted"
      }
     },
     "effect": "committed"
    }
   },
   "on": "b",
   "because": "HP EV-1"
  },
  {
   "expect": {
    "lane": "invoke",
    "type": "Invoke",
    "payload": {
     "epoch": "$e",
     "request_id": "$c2",
     "handler": "he",
     "origin": "event",
     "payload": {
      "owner": "b",
      "name": "e",
      "source": {
       "kind": "plugin",
       "instance": {
        "$ne": "$i1"
       }
      }
     }
    }
   },
   "because": "HP EV-9"
  },
  {
   "send_frame": {
    "lane": "invoke",
    "type": "Result",
    "payload": {
     "epoch": "$e",
     "request_id": "$c2",
     "result": {
      "ok": true,
      "value": {}
     }
    }
   }
  },
  {
   "send_frame": {
    "lane": "invoke",
    "type": "Result",
    "payload": {
     "epoch": "$e_b2",
     "request_id": "$r_b2",
     "result": {
      "ok": true,
      "value": {}
     }
    }
   },
   "conn": "b"
  }
 ]
}
