{
  "id": "conf::ui_em_14_to_page_rows_shape",
  "contract": "ui",
  "clause": "UI-EM-14",
  "subject": "client",
  "setup": {
    "admission": {
      "kinds": {
        "botster-graph.node": {
          "projection_allowlist": [
            "/label",
            "/count"
          ],
          "owner": "botster-graph"
        }
      },
      "handlers": {},
      "package": "botster-graph",
      "views": []
    },
    "app_origin": "https://app.example.test"
  },
  "steps": [
    {
      "client_load": {
        "document": {
          "ui_contract_view": "1.4",
          "id": "graph",
          "title": "Graph",
          "requires": [
            "ui_embed"
          ],
          "root": {
            "type": "embed",
            "id": "page",
            "title": "Knowledge graph",
            "page": {
              "asset": {
                "name": "graph"
              }
            },
            "empty": {
              "title": "No page"
            },
            "error": {
              "title": "Page unavailable"
            },
            "channel": {
              "to_page": [
                {
                  "type": "rows",
                  "source": {
                    "kind": "botster-graph.node"
                  },
                  "fields": [
                    "/label",
                    "/count"
                  ],
                  "on": "change"
                }
              ]
            }
          }
        },
        "capabilities": {
          "ui_contract_view": [
            "1.4"
          ],
          "features": [
            "ui_embed",
            "embed"
          ]
        },
        "kind_snapshots": {
          "botster-graph.node": {
            "baseline": true,
            "rows": [
              {
                "id": "n1",
                "label": "A"
              }
            ]
          }
        }
      }
    },
    {
      "client_expect": {
        "observation": {
          "request_sent": {
            "action": "open_asset",
            "count": 1,
            "target": "botster-graph",
            "args": {
              "name": "graph"
            }
          }
        },
        "because": "UI UI-EM-7"
      }
    },
    {
      "client_act": {
        "action": {
          "hub_result": {
            "request": 1,
            "ok": {
              "url": "https://assets.example.test:7443/botster-graph/ast_1?t=TOKEN_SENTINEL_1",
              "expires_at": 1790840000001
            }
          }
        }
      }
    },
    {
      "client_act": {
        "action": {
          "frame_load": {}
        }
      }
    },
    {
      "client_expect": {
        "observation": {
          "channel": "open"
        },
        "because": "UI UI-EM-5",
        "node_id": "page"
      }
    },
    {
      "client_expect": {
        "observation": {
          "pushed": {
            "type": "rows",
            "payload": {
              "rows": [
                {
                  "id": "n1",
                  "fields": {
                    "/label": "A"
                  }
                }
              ]
            }
          }
        },
        "because": "UI UI-EM-14"
      }
    },
    {
      "client_act": {
        "action": {
          "hub_rows": {
            "kind": "botster-graph.node",
            "baseline": true,
            "rows": [
              {
                "id": "n1",
                "label": "A",
                "count": 3
              }
            ]
          }
        }
      }
    },
    {
      "client_expect": {
        "observation": {
          "pushed": {
            "type": "rows",
            "payload": {
              "rows": [
                {
                  "id": "n1",
                  "fields": {
                    "/label": "A",
                    "/count": 3
                  }
                }
              ]
            }
          }
        },
        "because": "UI UI-EM-14"
      }
    }
  ]
}
